ItemName,Description,Value
BHCKG806,ALL OTHER LIABILITIES (LESS: AMOUNTS NETTED IN THE DETERMINATION OF TOTAL FAIR VALUE) (BHC CONSOLIDATED),282000
BHCKG807,ALL OTHER LIABILITIES (LEVEL 1 FAIR VALUE MEASUREMENTS) (BHC CONSOLIDATED),0
BHCKG808,ALL OTHER LIABILITIES (LEVEL 2 FAIR VALUE MEASUREMENTS) (BHC CONSOLIDATED),319000
BHCKG809,ALL OTHER LIABILITIES (LEVEL 3 FAIR VALUE MEASUREMENTS) (BHC CONSOLIDATED),140000
BHCKG531,TOTAL LIABILITIES MEASURED AT FAIR VALUE ON A RECURRING BASIS (TOTAL FAIR VALUE REPORTED ON SCHEDULE HC) (BHC CONSOLIDATED),767923000
BHCKG532,TOTAL LIABILITIES MEASURED AT FAIR VALUE ON A RECURRING BASIS (LESS: AMOUNTS NETTED IN THE DETERMINATION OF TOTAL FAIR VALUE) (BHC CONSOLIDATED),566072000
BHCKG533,TOTAL LIABILITIES MEASURED AT FAIR VALUE ON A RECURRING BASIS (LEVEL 1 FAIR VALUE MEASUREMENTS) (BHC CONSOLIDATED),145106000
BHCKG534,TOTAL LIABILITIES MEASURED AT FAIR VALUE ON A RECURRING BASIS (LEVEL 2 FAIR VALUE MEASUREMENTS) (BHC CONSOLIDATED),1157091000
BHCKG535,TOTAL LIABILITIES MEASURED AT FAIR VALUE ON A RECURRING BASIS (LEVEL 3 FAIR VALUE MEASUREMENTS) (BHC CONSOLIDATED),31798000
BHCKG536,ALL OTHER ASSETS: MORTGAGE SERVICING ASSETS (TOTAL FAIR VALUE REPORTED ON SCHEDULE HC) (BHC CONSOLIDATED),0
BHCKG537,ALL OTHER ASSETS: MORTGAGE SERVICING ASSETS (LESS: AMOUNTS NETTED IN THE DETERMINATION OF TOTAL FAIR VALUE) (BHC CONSOLIDATED),0
BHCKG538,ALL OTHER ASSETS: MORTGAGE SERVICING ASSETS (LEVEL 1 FAIR VALUE MEASUREMENTS) (BHC CONSOLIDATED),0
BHCKG539,ALL OTHER ASSETS: MORTGAGE SERVICING ASSETS (LEVEL 2 FAIR VALUE MEASUREMENTS) (BHC CONSOLIDATED),0
BHCKG540,ALL OTHER ASSETS: MORTGAGE SERVICING ASSETS (LEVEL 3 FAIR VALUE MEASUREMENTS) (BHC CONSOLIDATED),0
BHCKG541,ALL OTHER ASSETS: NONTRADING DERIVATIVE ASSETS (TOTAL FAIR VALUE REPORTED ON SCHEDULE HC) (BHC CONSOLIDATED),0
BHCKG542,ALL OTHER ASSETS: NONTRADING DERIVATIVE ASSETS (LESS: AMOUNTS NETTED IN THE DETERMINATION OF TOTAL FAIR VALUE) (BHC CONSOLIDATED),0
BHCKG543,ALL OTHER ASSETS: NONTRADING DERIVATIVE ASSETS (LEVEL 1 FAIR VALUE MEASUREMENTS) (BHC CONSOLIDATED),0
BHCKG544,ALL OTHER ASSETS: NONTRADING DERIVATIVE ASSETS (LEVEL 2 FAIR VALUE MEASUREMENTS) (BHC CONSOLIDATED),0
BHCKG545,ALL OTHER ASSETS: NONTRADING DERIVATIVE ASSETS (LEVEL 3 FAIR VALUE MEASUREMENTS) (BHC CONSOLIDATED),0
BHCKG547,ALL OTHER ASSETS: [RESPONDENT ENTERED TEXT - FINANCIAL VALUE] (LESS: AMOUNTS NETTED IN THE DETERMINATION OF TOTAL FAIR VALUE) (BHC CONSOLIDATED),0
BHCKG548,ALL OTHER ASSETS: [RESPONDENT ENTERED TEXT - FINANCIAL VALUE] (LEVEL 1 FAIR VALUE MEASUREMENTS) (BHC CONSOLIDATED),0
BHCKG549,ALL OTHER ASSETS: [RESPONDENT ENTERED TEXT - FINANCIAL VALUE] (LEVEL 2 FAIR VALUE MEASUREMENTS) (BHC CONSOLIDATED),1763000
BHCKG550,ALL OTHER ASSETS: [RESPONDENT ENTERED TEXT - FINANCIAL VALUE] (LEVEL 3 FAIR VALUE MEASUREMENTS) (BHC CONSOLIDATED),0
BHCKG552,ALL OTHER ASSETS: [RESPONDENT ENTERED TEXT - FINANCIAL VALUE] (LESS: AMOUNTS NETTED IN THE DETERMINATION OF TOTAL FAIR VALUE) (BHC CONSOLIDATED),0
BHCKG553,ALL OTHER ASSETS: [RESPONDENT ENTERED TEXT - FINANCIAL VALUE] (LEVEL 1 FAIR VALUE MEASUREMENTS) (BHC CONSOLIDATED),0
BHCKG554,ALL OTHER ASSETS: [RESPONDENT ENTERED TEXT - FINANCIAL VALUE] (LEVEL 2 FAIR VALUE MEASUREMENTS) (BHC CONSOLIDATED),0
BHCKG555,ALL OTHER ASSETS: [RESPONDENT ENTERED TEXT - FINANCIAL VALUE] (LEVEL 3 FAIR VALUE MEASUREMENTS) (BHC CONSOLIDATED),0
BHCKG557,ALL OTHER ASSETS: [RESPONDENT ENTERED TEXT - FINANCIAL VALUE] (LESS: AMOUNTS NETTED IN THE DETERMINATION OF TOTAL FAIR VALUE) (BHC CONSOLIDATED),0
BHCKG558,ALL OTHER ASSETS: [RESPONDENT ENTERED TEXT - FINANCIAL VALUE] (LEVEL 1 FAIR VALUE MEASUREMENTS) (BHC CONSOLIDATED),0
BHCKG559,ALL OTHER ASSETS: [RESPONDENT ENTERED TEXT - FINANCIAL VALUE] (LEVEL 2 FAIR VALUE MEASUREMENTS) (BHC CONSOLIDATED),0
BHCKG560,ALL OTHER ASSETS: [RESPONDENT ENTERED TEXT - FINANCIAL VALUE] (LEVEL 3 FAIR VALUE MEASUREMENTS) (BHC CONSOLIDATED),0
BHCKG562,ALL OTHER ASSETS: [RESPONDENT ENTERED TEXT - FINANCIAL VALUE] (LESS: AMOUNTS NETTED IN THE DETERMINATION OF TOTAL FAIR VALUE) (BHC CONSOLIDATED),0
BHCKG563,ALL OTHER ASSETS: [RESPONDENT ENTERED TEXT - FINANCIAL VALUE] (LEVEL 1 FAIR VALUE MEASUREMENTS) (BHC CONSOLIDATED),0
BHCKG564,ALL OTHER ASSETS: [RESPONDENT ENTERED TEXT - FINANCIAL VALUE] (LEVEL 2 FAIR VALUE MEASUREMENTS) (BHC CONSOLIDATED),0
BHCKG565,ALL OTHER ASSETS: [RESPONDENT ENTERED TEXT - FINANCIAL VALUE] (LEVEL 3 FAIR VALUE MEASUREMENTS) (BHC CONSOLIDATED),0
BHCKG566,ALL OTHER LIABILITIES: NONTRADING DERIVATIVE LIABILITIES (TOTAL FAIR VALUE REPORTED ON SCHEDULE HC) (BHC CONSOLIDATED),0
BHCKG567,ALL OTHER LIABILITIES: NONTRADING DERIVATIVE LIABILITIES (LESS: AMOUNTS NETTED IN THE DETERMINATION OF TOTAL FAIR VALUE) (BHC CONSOLIDATED),0
BHCKG568,ALL OTHER LIABILITIES: NONTRADING DERIVATIVE LIABILITIES (LEVEL 1 FAIR VALUE MEASUREMENTS) (BHC CONSOLIDATED),0
BHCKG569,ALL OTHER LIABILITIES: NONTRADING DERIVATIVE LIABILITIES (LEVEL 2 FAIR VALUE MEASUREMENTS) (BHC CONSOLIDATED),0
BHCKG570,ALL OTHER LIABILITIES: NONTRADING DERIVATIVE LIABILITIES (LEVEL 3 FAIR VALUE MEASUREMENTS) (BHC CONSOLIDATED),0
BHCKG572,ALL OTHER LIABILITIES: [RESPONDENT ENTERED TEXT - FINANCIAL VALUE] (LESS: AMOUNTS NETTED IN THE DETERMINATION OF TOTAL FAIR VALUE) (BHC CONSOLIDATED),0
BHCKG573,ALL OTHER LIABILITIES: [RESPONDENT ENTERED TEXT - FINANCIAL VALUE] (LEVEL 1 FAIR VALUE MEASUREMENTS) (BHC CONSOLIDATED),0
BHCKG574,ALL OTHER LIABILITIES: [RESPONDENT ENTERED TEXT - FINANCIAL VALUE] (LEVEL 2 FAIR VALUE MEASUREMENTS) (BHC CONSOLIDATED),0
BHCKG575,ALL OTHER LIABILITIES: [RESPONDENT ENTERED TEXT - FINANCIAL VALUE] (LEVEL 3 FAIR VALUE MEASUREMENTS) (BHC CONSOLIDATED),82000
BHCKG577,ALL OTHER LIABILITIES: [RESPONDENT ENTERED TEXT - FINANCIAL VALUE] (LESS: AMOUNTS NETTED IN THE DETERMINATION OF TOTAL FAIR VALUE) (BHC CONSOLIDATED),0
BHCKG578,ALL OTHER LIABILITIES: [RESPONDENT ENTERED TEXT - FINANCIAL VALUE] (LEVEL 1 FAIR VALUE MEASUREMENTS) (BHC CONSOLIDATED),0
BHCKG579,ALL OTHER LIABILITIES: [RESPONDENT ENTERED TEXT - FINANCIAL VALUE] (LEVEL 2 FAIR VALUE MEASUREMENTS) (BHC CONSOLIDATED),0
BHCKG580,ALL OTHER LIABILITIES: [RESPONDENT ENTERED TEXT - FINANCIAL VALUE] (LEVEL 3 FAIR VALUE MEASUREMENTS) (BHC CONSOLIDATED),0
BHCKG582,ALL OTHER LIABILITIES: [RESPONDENT ENTERED TEXT - FINANCIAL VALUE] (LESS: AMOUNTS NETTED IN THE DETERMINATION OF TOTAL FAIR VALUE) (BHC CONSOLIDATED),0
BHCKG583,ALL OTHER LIABILITIES: [RESPONDENT ENTERED TEXT - FINANCIAL VALUE] (LEVEL 1 FAIR VALUE MEASUREMENTS) (BHC CONSOLIDATED),0
BHCKG584,ALL OTHER LIABILITIES: [RESPONDENT ENTERED TEXT - FINANCIAL VALUE] (LEVEL 2 FAIR VALUE MEASUREMENTS) (BHC CONSOLIDATED),0
BHCKG585,ALL OTHER LIABILITIES: [RESPONDENT ENTERED TEXT - FINANCIAL VALUE] (LEVEL 3 FAIR VALUE MEASUREMENTS) (BHC CONSOLIDATED),0
BHCKG587,ALL OTHER LIABILITIES: [RESPONDENT ENTERED TEXT - FINANCIAL VALUE] (LESS: AMOUNTS NETTED IN THE DETERMINATION OF TOTAL FAIR VALUE) (BHC CONSOLIDATED),0
BHCKG588,ALL OTHER LIABILITIES: [RESPONDENT ENTERED TEXT - FINANCIAL VALUE] (LEVEL 1 FAIR VALUE MEASUREMENTS) (BHC CONSOLIDATED),0
BHCKG589,ALL OTHER LIABILITIES: [RESPONDENT ENTERED TEXT - FINANCIAL VALUE] (LEVEL 2 FAIR VALUE MEASUREMENTS) (BHC CONSOLIDATED),0
BHCKG590,ALL OTHER LIABILITIES: [RESPONDENT ENTERED TEXT - FINANCIAL VALUE] (LEVEL 3 FAIR VALUE MEASUREMENTS) (BHC CONSOLIDATED),0
BHTXG546,ALL OTHER ASSETS: [RESPONDENT ENTERED TEXT],Term time deposits
BHCKG546,ALL OTHER ASSETS: [RESPONDENT ENTERED TEXT - FINANCIAL VALUE] (TOTAL FAIR VALUE REPORTED ON SCHEDULE HC) (BHC CONSOLIDATED),1763000
BHCKG551,ALL OTHER ASSETS: [RESPONDENT ENTERED TEXT - FINANCIAL VALUE] (TOTAL FAIR VALUE REPORTED ON SCHEDULE HC) (BHC CONSOLIDATED),0
BHCKG556,ALL OTHER ASSETS: [RESPONDENT ENTERED TEXT - FINANCIAL VALUE] (TOTAL FAIR VALUE REPORTED ON SCHEDULE HC) (BHC CONSOLIDATED),0
BHCKG561,ALL OTHER ASSETS: [RESPONDENT ENTERED TEXT - FINANCIAL VALUE] (TOTAL FAIR VALUE REPORTED ON SCHEDULE HC) (BHC CONSOLIDATED),0
BHTXG571,ALL OTHER LIABILITIES: [RESPONDENT ENTERED TEXT],Reinsurance Contracts
BHCKG571,ALL OTHER LIABILITIES: [RESPONDENT ENTERED TEXT - FINANCIAL VALUE] (TOTAL FAIR VALUE REPORTED ON SCHEDULE HC) (BHC CONSOLIDATED),82000
BHCKG576,ALL OTHER LIABILITIES: [RESPONDENT ENTERED TEXT - FINANCIAL VALUE] (TOTAL FAIR VALUE REPORTED ON SCHEDULE HC) (BHC CONSOLIDATED),0
BHCKG581,ALL OTHER LIABILITIES: [RESPONDENT ENTERED TEXT - FINANCIAL VALUE] (TOTAL FAIR VALUE REPORTED ON SCHEDULE HC) (BHC CONSOLIDATED),0
BHCKG586,ALL OTHER LIABILITIES: [RESPONDENT ENTERED TEXT - FINANCIAL VALUE] (TOTAL FAIR VALUE REPORTED ON SCHEDULE HC) (BHC CONSOLIDATED),0
BHCKJ454,LOANS TO NON-DEPOSITORY FINANCIAL INSTITUTIONS (CONSOLIDATED) (BHC CONSOLIDATED),116740000
BHDMJ454,LOANS TO NON-DEPOSITORY FINANCIAL INSTITUTIONS (DOMESTIC) (BHC CONSOL. U.S. OFC),112300000
BHCKJ451,ALL OTHER LOANS(EXCLUDE CONSUMER LOANS) (CONSOLIDATED) (BHC CONSOLIDATED),13271000
BHDMJ451,ALL OTHER LOANS(EXCLUDE CONSUMER LOANS) (DOMESTIC) (BHC CONSOL. U.S. OFC),10873000
BHDM3516,QUARTERLY AVERAGE: TOTAL LOANS AND LEASES IN DOMESTIC OFFICES (BHC CONSOL. U.S. OFC),260878000
BHFN3360,"QUARTERLY AVERAGE: TOTAL LOANS IN FOREIGN OFFICES, EDGE AND AGREEMENT SUBSIDIARIES, AND IBFS (BHC CONSOL. FOREIGN OFC.)",40776000
BHCKJ457,OTHER UNUSED COMMITMENTS: COMMERCIAL AND INDUSTRIAL LOANS (BHC CONSOLIDATED),167223000
BHCKJ458,OTHER UNUSED COMMITMENTS: LOANS TO FINANCIAL INSTITUTIONS (BHC CONSOLIDATED),66915000
BHCKJ459,OTHER UNUSED COMMITMENTS: ALL OTHER UNUSED COMMITMENTS (BHC CONSOLIDATED),120321000
BHCKK141,"OUTSTANDING ISSUANCES OF PERPETUAL PREFERRED STOCK ASSOCIATED WITH THE DEPARTMENT OF TREASURY COMMUNITY DEVELOPMENT CAPITAL INITIATIVE (CDCI) PROGRAM INCLUDED IN SCHEDULE HC, ITEM 23, PERPETUAL PREFER",0
BHCK3411,COMMERCIAL LETTERS OF CREDIT (BHC CONSOLIDATED),0
BHCK3434,GROSS COMMITMENTS TO PURCHASE WHEN-ISSUED SECURITIES (BHC CONSOLIDATED),0
BHCK3435,GROSS COMMITMENTS TO SELL WHEN-ISSUED SECURITIES (BHC CONSOLIDATED),0
BHCK3432,SECURITIES BORROWED (BHC CONSOLIDATED),234201000
BHCK3433,SECURITIES LENT (BHC CONSOLIDATED),161457000
BHCK3430,ALL OTHER OFF BALANCE SHEET LIABILITIES (BHC CONSOLIDATED),90864000
BHCK3450,"NOTIONAL VALUE: SWAPS, INTEREST RATE CONTRACTS (BHC CONSOLIDATED)",19053466000
BHCK3814,"UNUSED COMMITMENTS-REVOLVING, ETC. (BHC CONSOLIDATED)",114000
BHCK6550,COMMITMENTS TO FUND LOANS NOT SECURED BY REAL ESTATE (BHC CONSOLIDATED),234000
BHCK3817,UNUSED COMMITMENTS-SECS UNDERWRITING (BHC CONSOLIDATED),0
BHCK3826,"NOTIONAL VALUE: SWAPS, FOREIGN EXCHANGE CONTRACTS (BHC CONSOLIDATED)",2845047000
BHCK3459,TOT # OF BK HLDG CO SHRS ISSUED&OUTS (BHC CONSOLIDATED),300124881
BHCK4150,# OF FULL-TIME EQUIVALENT EMPLOYEES (BHC CONSOLIDATED),48300
BHCK6556,"DEBT MATURING IN MORE THAN ONE YEAR (INCLUDED IN SCHEDULE HC, ITEMS 16 AND 19A) THAT IS ISSUED TO UNRELATED THIRD PARTIES BY BANK SUBSIDIARIES (BHC CONSOLIDATED)",13715000
BHCK6557,OTH ASSETS ACQD IN SATFCTN OF DEBTS (BHC CONSOLIDATED),80000
BHCK3656,DIRECT AND INDIRECT INVESTMENTS IN REAL ESTATE VENTURES (BHC CONSOLIDATED),1375000
BHCK6689,"HAS BHC RESTATED FINANCIAL STATEMTS? (1-YES, 0-NO) (BHC CONSOLIDATED)",0
BHCK1607,"C&I LN PAST DUE 90 OR MORE, ACCRUING (BHC CONSOLIDATED)",61000
BHCK1608,"C&I LOANS, NONACCRUAL (BHC CONSOLIDATED)",2255000
BHCK1597,"LN TO FRMERS,PAST 90 OR MORE,ACCRUING (BHC CONSOLIDATED)",0
BHCK1583,"LOANS TO FARMERS, NONACCRUAL (BHC CONSOLIDATED)",0
BHCK1407,PAST DUE 90 DAYS OR MORE AND STILL ACCRUING: TOTAL LOANS AND LEASES (BHC CONSOLIDATED),491000
BHCK1403,NONACCRUAL: TOTAL LOANS AND LEASES (BHC CONSOLIDATED),4919000
BHCK1912,LNS&LEASES-PAST DUE 90 DAYS OR MORE (BHC CONSOLIDATED),65000
BHCK1913,LNS&LEASES-NONACCRUAL (BHC CONSOLIDATED),1485000
BHCK3506,"OTHER ASSETS, PAST DUE 90+ DAYS, ACCRUING (BHC CONSOLIDATED)",0
BHCK3507,"OTHER ASSETS, NONACCRUAL (BHC CONSOLIDATED)",0
BHCK6559,"COMMCL RE,ETC.-PAST DUE 90DYS OR MOR (BHC CONSOLIDATED)",0
BHCK6560,"COMMCL RE,ETC.-NONACCRUAL (BHC CONSOLIDATED)",98000
BHCK3494,LNS SECD BY FARMLAND-PAST DUE 90DYS (BHC CONSOLIDATED),0
BHCK3495,LNS SECD BY FARMLAND-NONACCRUAL (BHC CONSOLIDATED),0
BHCK3500,LNS SECD BY MULTIFAMILY-PST DU 90DYS (BHC CONSOLIDATED),0
BHCK3501,LNS SECD BY MULTIFAMILY-NONACCRUAL (BHC CONSOLIDATED),100000
BHCK6555,"DEBT MATURING IN ONE YEAR OR LESS (INCLUDED IN SCHEDULE HC, ITEMS 16 AND 19A) THAT IS ISSUED TO UNRELATED THIRD PARTIES BY BANK SUBSIDIARIES (BHC CONSOLIDATED)",12697000
BHCK5378,"LNS TO US BKS,ETC.-PAST DU 90 DYS OR (BHC CONSOLIDATED)",0
BHCK5379,"LNS TO US BKS,ETC.-NONACCRUAL (BHC CONSOLIDATED)",0
BHCK5381,LNS TO FOREIGN BKS-PAST DU 90 DYS OR (BHC CONSOLIDATED),0
BHCK5382,LNS TO FOREIGN BKS-NONACCRUAL (BHC CONSOLIDATED),33000
BHCK5390,"LNS TO FGN GOV,ETC.-PAS DU 90 DYS OR (BHC CONSOLIDATED)",0
BHCK5391,"LNS TO FGN GOV,ETC.-NONACCRUAL (BHC CONSOLIDATED)",0
BHCK5399,"RVLVG,OPEN-END LNS-PAST DU 90 DYS OR (BHC CONSOLIDATED)",0
BHCK5400,"RVLVG,OPEN-END LNS-NONACCRUAL (BHC CONSOLIDATED)",8000
BHCK3816,COMMTMTS TO FUND LNS SECD BY RE (BHC CONSOLIDATED),5871000
BHCK5460,ALL OTHER LOANS-PAST DU 90 DYS OR MO (BHC CONSOLIDATED),0
BHCK5461,ALL OTHER LOANS-NONACCRUAL (BHC CONSOLIDATED),280000
BHCK6416,"CHANGES IN INVESTMENTS AND ACTIVITIES REPORTED ON FR Y-6A? (1-YES, 0-NO) (BHC CONSOLIDATED)",1
BHCK3530,DERIVATIVE CONTRACTS: FAIR VALUE AMOUNTS CARRIED AS ASSETS (PAST DUE 90 DAYS OR MORE AND STILL ACCRUING) (BHC CONSOLIDATED),62000
BHCK6561,1ST AMOUNT - OTHER SIGNIFICANT OFF-BALANCE SHEET ITEMS > 25% OF TOTAL EQUITY CAPITAL (BHC CONSOLIDATED),90864000
BHCK6562,2ND AMOUNT - OTHER SIGNIFICANT OFF-BALANCE SHEET ITEMS > 25% OF TOTAL EQUITY CAPITAL (BHC CONSOLIDATED),0
BHCK6568,3RD AMOUNT - OTHER SIGNIFICANT OFF-BALANCE SHEET ITEMS > 25% OF TOTAL EQUITY CAPITAL (BHC CONSOLIDATED),0
BHCK6586,4TH AMOUNT - OTHER SIGNIFICANT OFF-BALANCE SHEET ITEMS > 25% OF TOTAL EQUITY CAPITAL (BHC CONSOLIDATED),0
BHCK8765,SPOT FOREIGN EXCHANGE CONTRACTS (BHC CONSOLIDATED),353332000
BHCK8693,NOTIONAL VALUE OF INTEREST RATE FUTURE CONTRACTS (BHC CONSOLIDATED),1264080000
BHCK8694,NOTIONAL VALUE OF FOREIGN EXCHANGE FUTURE CONTRACTS (BHC CONSOLIDATED),6903000
BHCK8695,NOTIONAL VALUE OF EQUITY DERIVATIVE FUTURE CONTRACTS (BHC CONSOLIDATED),264769000
BHCK8696,NOTIONAL VALUE OF FUTURE COMMODITY AND OTHER CONTRACTS (BHC CONSOLIDATED),248002000
BHCK8697,NOTIONAL VALUE OF FORWARD INTEREST RATE CONTRACTS (BHC CONSOLIDATED),2941240000
BHCK8698,NOTIONAL VALUE OF FORWARD FOREIGN EXCHANGE CONTRACTS (BHC CONSOLIDATED),3828134000
BHCK8699,NOTIONAL VALUE OF FORWARD EQUITY DERIVATIVE CONTRACTS (BHC CONSOLIDATED),11897000
BHCK8700,NOTIONAL VALUE OF FORWARD COMMODITY AND OTHER CONTRACTS (BHC CONSOLIDATED),31504000
BHCK8701,"NOTIONAL VALUE OF WRITTEN, EXCHANGE-TRADED INTEREST RATE CONTRACTS (BHC CONSOLIDATED)",323141000
BHCK8702,"NOTIONAL VALUE OF WRITTEN, EXCHANGE-TRADED FOREIGN EXCHANGE CONTRACTS (BHC CONSOLIDATED)",2276000
BHCK8703,"NOTIONAL VALUE OF WRITTEN, EXCHANGE-TRADED EQUITY DERIVATIVE CONTRACTS (BHC CONSOLIDATED)",1071305000
BHCK8704,"NOTIONAL VALUE OF WRITTEN, EXCHANGE-TRADED COMMODITY AND OTHER CONTRACTS (BHC CONSOLIDATED)",64499000
BHCK8705,"NOTIONAL VALUE OF EXCHANGE-TRADED, PURCHASED INTEREST RATE CONTRACTS (BHC CONSOLIDATED)",488796000
BHCK8706,"NOTIONAL VALUE OF EXCHANGE-TRADED, PURCHASED FOREIGN EXCHANGE CONTRACTS (BHC CONSOLIDATED)",1790000
BHCK8707,"NOTIONAL VALUE OF EXCHANGE-TRADED, PURCHASED EQUITY DERIVATIVE CONTRACTS (BHC CONSOLIDATED)",1072486000
BHCK8708,"NOTIONAL VALUE OF EXCHANGE-TRADED, PURCHASED COMMODITY AND OTHER CONTRACTS (BHC CONSOLIDATED)",60674000
BHCK8709,"NOTIONAL VALUE OF OVER-THE-COUNTER, WRITTEN INTEREST RATE CONTRACTS (BHC CONSOLIDATED)",4069405000
BHCK8710,"NOTIONAL VALUE OF OVER-THE-COUNTER, WRITTEN FOREIGN EXCHANGE CONTRACTS (BHC CONSOLIDATED)",643542000
BHCK8711,"NOTIONAL VALUE OF OVER-THE-COUNTER, WRITTEN EQUITY DERIVATIVE CONTRACTS (BHC CONSOLIDATED)",336922000
BHCK8712,"NOTIONAL VALUE OF OVER-THE-COUNTER, WRITTEN COMMODITY AND OTHER CONTRACTS (BHC CONSOLIDATED)",29916000
BHCK8713,"NOTIONAL VALUE OF OVER-THE-COUNTER, PURCHASED INTEREST RATE CONTRACTS (BHC CONSOLIDATED)",3903851000
BHCK8714,"NOTIONAL VALUE OF OVER-THE-COUNTER, PURCHASED FOREIGN EXCHANGE CONTRACTS (BHC CONSOLIDATED)",687946000
BHCK8715,"NOTIONAL VALUE OF OVER-THE-COUNTER, PURCHASED EQUITY DERIVATIVE CONTRACTS (BHC CONSOLIDATED)",325787000
BHCK8716,"NOTIONAL VALUE OF OVER-THE-COUNTER, PURCHASED COMMODITY AND OTHER CONTRACTS (BHC CONSOLIDATED)",34633000
BHCK8719,"NOTIONAL VALUE: SWAPS, EQUITY DERIVATIVE CONTRACTS (BHC CONSOLIDATED)",937635000
BHCK8720,"NOTIONAL VALUE: SWAPS, COMMODITY AND OTHER CONTRACTS (BHC CONSOLIDATED)",102813000
BHCKA126,TOTAL GROSS NOTIONAL AMOUNT OF INTEREST RATE DERIVATIVE CONTRACTS HELD FOR TRADING (BHC CONSOLIDATED),31750922000
BHCKA127,TOTAL GROSS NOTIONAL AMOUNT OF FOREIGN EXCHANGE DERIVATIVE CONTRACTS HELD FOR TRADING (BHC CONSOLIDATED),7993036000
BHCK8723,NOTIONAL VALUE OF EQUITY DERIVATIVE CONTRACTS HELD FOR TRADING (BHC CONSOLIDATED),4020717000
BHCK8724,NOTIONAL VALUE OF COMMODITY AND OTHER CONTRACTS HELD FOR TRADING (BHC CONSOLIDATED),572041000
BHCK8725,"NOTIONAL VALUE OF INTEREST RATE CONTRACTS HELD FOR PURPOSES OTHER THAN TRADING, MARKED TO MARKET (BHC CONSOLIDATED)",293057000
BHCK8726,"NOTIONAL VALUE OF FOREIGN EXCHANGE CONTRACTS HELD FOR PURPOSES OTHER THAN TRADING, MARKED TO MARKET (BHC CONSOLIDATED)",22602000
BHCK8727,"NOTIONAL VALUE OF EQUITY DERIVATIVE CONTRACTS HELD FOR PURPOSES OTHER THAN TRADING, MARKED TO MARKET (BHC CONSOLIDATED)",84000
BHCK8728,"NOTIONAL VALUE OF COMMODITY AND OTHER CONTRACTS HELD FOR PURPOSES OTHER THAN TRADING, MARKED TO MARKET (BHC CONSOLIDATED)",0
BHCK8733,POSITIVE FAIR VALUE OF INTEREST RATE CONTRACTS HELD FOR TRADING (BHC CONSOLIDATED),158068000
BHCK8734,POSITIVE FAIR VALUE OF FOREIGN EXCHANGE CONTRACTS HELD FOR TRADING (BHC CONSOLIDATED),76483000
BHCK8735,POSTIVE FAIR VALUE OF EQUITY DERIVATIVE CONTRACTS HELD FOR TRADING (BHC CONSOLIDATED),110740000
BHCK8736,POSITIVE FAIR VALUE OF COMMODITY AND OTHER CONTRACTS HELD FOR TRADING (BHC CONSOLIDATED),13531000
BHCK8737,NEGATIVE FAIR VALUE OF INTEREST RATE CONTRACTS HELD FOR TRADING (BHC CONSOLIDATED),120108000
BHCK8738,NEGATIVE FAIR VALUE OF FOREIGN EXCHANGE CONTRACTS HELD FOR TRADING (BHC CONSOLIDATED),76364000
BHCK8739,NEGATIVE FAIR VALUE OF EQUITY DERIVATIVE CONTRACTS HELD FOR TRADING (BHC CONSOLIDATED),169166000
BHCK8740,NEGATIVE FAIR VALUE OF COMMODITY AND OTHER CONTRACTS HELD FOR TRADING (BHC CONSOLIDATED),15401000
BHCK8741,"POSITIVE FAIR VALUE OF INTEREST RATE CONTRACTS HELD FOR PURPOSES OTHER THAN TRADING, MARKED TO MARKET (BHC CONSOLIDATED)",180000
BHCK8742,"POSITIVE FAIR VALUE OF FOREIGN EXCHANGE CONTRACTS HELD FOR PURPOSES OTHER THAN TRADING, MARKED TO MARKET (BHC CONSOLIDATED)",6000
BHCK8743,"POSITIVE FAIR VALUE OF EQUITY DERIVATIVE CONTRACTS HELD FOR PURPOSES OTHER THAN TRADING, MARKED TO MARKET (BHC CONSOLIDATED)",0
BHCK8744,"POSITIVE FAIR VALUE OF COMMODITY AND OTHER CONTRACTS HELD FOR PURPOSES OTHER THAN TRADING, MARKED TO MARKET (BHC CONSOLIDATED)",0
BHCK8745,"NEGATIVE FAIR VALUE OF INTEREST RATE CONTRACTS HELD FOR PURPOSES OTHER THAN TRADING, MARKED TO MARKET (BHC CONSOLIDATED)",8000
BHCK8746,"NEGATIVE FAIR VALUE OF FOREIGN EXCHANGE CONTRACTS HELD FOR PURPOSES OTHER THAN TRADING, MARKED TO MARKET (BHC CONSOLIDATED)",289000
BHCK8747,"NEGATIVE FAIR VALUE OF EQUITY DERIVATIVE CONTRACTS HELD FOR PURPOSES OTHER THAN TRADING, MARKED TO MARKET (BHC CONSOLIDATED)",0
BHCK8748,GROSS NEGATIVE FAIR VALUE OF COMMODITY AND OTHER DERIVATIVE CONTRACTS HELD FOR PURPOSES OTHER THAN TRADING THAT ARE MARKED TO MARKET. (BHC CONSOLIDATED),0
BHCKA288,SECURITIES PURCHASED UNDER AGREEMENT TO RESELL NETTED AGAINST SECURITIES SOLD UNDER AGREEMENTS TO REPURCHASE (BHC CONSOLIDATED),268045000
BHCKB556,"OTHER ASSETS, ACCRUED INTEREST RECEIVABLE (BHC CONSOLIDATED)",8140000
BHCK2148,"OTHER ASSETS, NET DEFERRED TAX ASSETS (BHC CONSOLIDATED)",8938000
BHCK2168,"OTHER ASSETS, OTHER (BHC CONSOLIDATED)",110352000
BHCK3049,"OTHER LIABILITIES, NET DEFERRED TAX LIABILITIES (BHC CONSOLIDATED)",868000
BHCKB557,"OTHER LIABILITIES, ALLOWANCE FOR CREDIT LOSSES ON OFF- BALANCE SHEET CREDIT EXPOSURES (BHC CONSOLIDATED)",800000
BHCKB984,"OTHER LIABILITIES, OTHER (BHC CONSOLIDATED)",286041000
BHCK6566,FINANCIAL STANDBY LETTERS OF CREDIT AND FOREIGN OFFICES GUARANTEES (BHC CONSOLIDATED),15390000
BHCK3820,AMOUNT OF FINANCIAL STANDBY LETTERS OF CREDIT CONVEYED TO OTHERS (BHC CONSOLIDATED),7915000
BHCK6570,PERFORMANCE STANDBY LETTERS OF CREDIT (BHC CONSOLIDATED),756000
BHCK3822,AMOUNT OF PERFORMANCE STANDBY LETTERS OF CREDIT CONVEYED TO OTHERS (BHC CONSOLIDATED),0
BHCKC013,OTHER NONINTEREST INCOME: INCOME AND FEES FROM PRINTING OF CHECKS (BHC CONSOLIDATED),0
BHCKC014,OTHER NONINTEREST INCOME: EARNINGS ON/INCREASE IN VALUE OF CASH SURRENDER VALUE OF LIFE INSURANCE (BHC CONSOLIDATED),0
BHCKC016,OTHER NONINTEREST INCOME: INCOME AND FEES FROM AUTOMATED TELLER MACHINES (ATMS) (BHC CONSOLIDATED),0
BHCK4042,OTHER NONINTEREST INCOME: RENT AND OTHER INCOME FROM REAL ESTATE OWNED (BHC CONSOLIDATED),0
BHCKC015,OTHER NONINTEREST INCOME: SAFE DEPOSIT BOX RENT (BHC CONSOLIDATED),0
BHCKC017,OTHER NONINTEREST EXPENSE: DATA PROCESSING EXPENSES (BHC CONSOLIDATED),0
BHCK0497,OTHER NONINTEREST EXPENSE: ADVERTISING AND MARKETING EXPENSES (BHC CONSOLIDATED),0
BHCK4136,OTHER NONINTEREST EXPENSE: DIRECTORS FEES (BHC CONSOLIDATED),0
BHCKC018,"OTHER NONINTEREST EXPENSE: PRINTING, STATIONERY, AND SUPPLIES (BHC CONSOLIDATED)",0
BHCK8403,OTHER NONINTEREST EXPENSE: POSTAGE (BHC CONSOLIDATED),0
BHCK4141,OTHER NONINTEREST EXPENSE: LEGAL FEES AND EXPENSES (BHC CONSOLIDATED),0
BHCKC242,PREMIUMS ON INSURANCE RELATED TO THE EXTENSION OF CREDIT (BHC CONSOLIDATED),0
BHCKC243,ALL OTHER INSURANCE PREMIUMS (BHC CONSOLIDATED),-1000
BHCK1606,"C&I LN PAST DUE 30-89 DAYS, ACCRUING (BHC CONSOLIDATED)",75000
BHCK1594,"LN TO FRMERS,PAST 30-89 DYS, ACCRUING (BHC CONSOLIDATED)",0
BHCK3508,"LNS&LEASES-PAST DUE 30-89 DYS, ACCRG (BHC CONSOLIDATED)",60000
BHCK3505,"OTHER ASSETS, PAST DUE 30-89 DAYS, ACCRUING (BHC CONSOLIDATED)",0
BHCK1406,PAST DUE 30 THROUGH 89 DAYS AND STILL ACCRUING: TOTAL LOANS AND LEASES (BHC CONSOLIDATED),1307000
BHCK6558,"COMMCL RE,ETC.-PAST DUE 30-89 DYS,AG (BHC CONSOLIDATED)",14000
BHCK3493,LNS SECD BY FARMLAND-PAST DUE 30-89 (BHC CONSOLIDATED),0
BHCK3499,LNS SECD BY MULTIFAMILY-PST DU 30-89 (BHC CONSOLIDATED),0
BHCK5377,"LNS TO US BKS,ETC.-PAST DU 30-89 DYS (BHC CONSOLIDATED)",0
BHCK5380,LNS TO FOREIGN BKS-PAST DU 30-89 DYS (BHC CONSOLIDATED),0
BHCK5389,"LNS TO FGN GOV,ETC.-PAS DU 30-89 DYS (BHC CONSOLIDATED)",0
BHCK5398,"RVLVG,OPEN-END LNS-PAST DU 30-89 DYS (BHC CONSOLIDATED)",16000
BHCK5459,ALL OTHER LOANS-PAST DU 30-89 DAYS (BHC CONSOLIDATED),0
BHCK3529,DERIVATIVE CONTRACTS: FAIR VALUE AMOUNTS CARRIED AS ASSETS (PAST DUE 30 THROUGH 89 DAYS AND STILL ACCRUING) (BHC CONSOLIDATED),6000
BHCKB572,"LOANS SECURED BY REAL ESTATE, IN FOREIGN OFFICES PAST DUE 30-89 DAYS, ACCRUING (BHC CONSOLIDATED)",45000
BHCKB573,"LOANS SECURED BY REAL ESTATE, IN FOREIGN OFFICES PAST DUE 90+ DAYS, ACCRUING (BHC CONSOLIDATED)",4000
BHCKB574,"LOANS SECURED BY REAL ESTATE, IN FOREIGN OFFICES NONACCRUAL (BHC CONSOLIDATED)",716000
BHCKB575,"LOANS TO INDIVIDUALS FOR HOUSEHOLDS, FAMILY AND OTHER PERSONAL EXPENDITURES: CREDIT CARDS PAST DUE 30-89 DAYS, ACCRUING (BHC CONSOLIDATED)",430000
BHCKB576,"LOANS TO INDIVIDUALS FOR HOUSEHOLDS, FAMILY AND OTHER PERSONAL EXPENDITURES: CREDIT CARDS PAST DUE 90+ DAYS, ACCRUING (BHC CONSOLIDATED)",426000
BHCKB577,"LOANS TO INDIVIDUALS FOR HOUSEHOLDS, FAMILY AND OTHER PERSONAL EXPENDITURES: CREDIT CARDS NONACCRUAL (BHC CONSOLIDATED)",0
BHCKB804,OUTSTANDING PRINCIPLE BALANCE OF ASSETS SERVICED FOR OTHERS: 1-4 FAMILY RESIDENTIAL MORTGAGES SERVICED WITH RECOURSE OR OTHER SERVICER-PROVIDED CREDIT ENHANCEMENTS (BHC CONSOLIDATED),0
BHCKB805,OUTSTANDING PRINCIPLE BALANCE OF ASSETS SERVICED FOR OTHERS: 1-4 FAMILY RESIDENTIAL MORTGAGES SERVICED WITH NO RECOURSE OR OTHER SERVICER-PROVIDED CREDIT ENHANCEMENTS (BHC CONSOLIDATED),2000
BHCKA591,OUTSTANDING PRINCIPAL BALANCE OF LOANS OTHER THAN 1-4 FAMILY RESIDENTIAL MORTGAGE LOANS THAT ARE SERVICED FOR OTHERS (IF BALANCE > $10 MILLION AND > 10% OF TOTAL ASSETS) (BHC CONSOLIDATED),1889000
BHCKB705,OUTSTANDING PRINCIPLE BAL. OF ASSETS SOLD & SECURITIZED WITH SERVICING RETAINED OR WITH RECOURSE OR OTHER SELLER PROVIDED CREDIT ENHANCEMENTS: 1 - 4 FAMILY RESIDENTIAL LOANS (BHC CONSOLIDATED),4192000
BHCKB706,OUTSTANDING PRINCIPLE BAL. OF ASSETS SOLD & SECURITIZED WITH SERVICING RETAINED OR WITH RECOURSE OR OTHER SELLER PROVIDED CREDIT ENHANCEMENTS: HOME EQUITY LINES (BHC CONSOLIDATED),0
BHCKB707,OUTSTANDING PRINCIPLE BAL. OF ASSETS SOLD & SECURITIZED WITH SERVICING RETAINED OR WITH RECOURSE OR OTHER SELLER PROVIDED CREDIT ENHANCEMENTS: CREDIT CARD RECEIVABLES (BHC CONSOLIDATED),0
BHCKB708,OUTSTANDING PRINCIPLE BAL. OF ASSETS SOLD & SECURITIZED WITH SERVICING RETAINED OR WITH RECOURSE OR OTHER SELLER PROVIDED CREDIT ENHANCEMENTS: AUTO LOANS (BHC CONSOLIDATED),0
BHCKB709,OUTSTANDING PRINCIPLE BAL. OF ASSETS SOLD & SECURITIZED WITH SERVICING RETAINED OR WITH RECOURSE OR OTHER SELLER PROVIDED CREDIT ENHANCEMENTS: OTHER CONSUMER LOANS (BHC CONSOLIDATED),623000
BHCKB710,OUTSTANDING PRINCIPLE BAL. OF ASSETS SOLD & SECURITIZED WITH SERVICING RETAINED OR WITH RECOURSE OR OTHER SELLER PROVIDED CREDIT ENHANCEMENTS: COMMERCIAL & INDUSTRIAL LOANS (BHC CONSOLIDATED),0
BHCKB711,OUTSTANDING PRINCIPLE BAL. OF ASSETS SOLD & SECURITIZED WITH SERVICING RETAINED OR WITH RECOURSE OR OTHER SELLER PROVIDED CREDIT ENHANCEMENTS: ALL OTHER LOANS AND ALL LEASES (BHC CONSOLIDATED),4154000
BHCKB726,"REPORTING BANK'S UNUSED COMMITMENTS TO PROVIDE LIQUIDITY T0 STRUCTURES, 1 - 4 FAMILY RESIDENTIAL LOANS (BHC CONSOLIDATED)",0
BHCKB727,"REPORTING BANK'S UNUSED COMMITMENTS TO PROVIDE LIQUIDITY T0 STRUCTURES, HOME EQUITY LINES (BHC CONSOLIDATED)",0
BHCKB728,"REPORTING BANK'S UNUSED COMMITMENTS TO PROVIDE LIQUIDITY T0 STRUCTURES, CREDIT CARD RECEIVABLES (BHC CONSOLIDATED)",0
