ItemName,Description,Value
Institution Name,,"GOLDMAN SACHS GROUP, INC., THE"
Street Address,,200 WEST STREET
City,,NEW YORK
State,,NY
Zip Code,,10282
Report Date,Reporting date in numeric format,20250930
ID_RSSD,Reporting entity identifier,2380443
BHCK0081,NONINTEREST BEARING BALANCES AND CURRENCY AND COIN DUE FROM DEPOSITORY INSTITUTIONS (BHC CONSOLIDATED),6744000
BHCK0395,INT-BEARING BALANCES IN U.S. OFFICES (BHC CONSOLIDATED),94624000
BHCK0397,INTEREST-BEARING BALANCES IN FOREIGN OFFICES (BHC CONSOLIDATED),69692000
BHCK2122,TOAL LOANS AND LEASES HELD FOR INVESTMENT AND HELD FOR SALE (BHC CONSOLIDATED),312668000
BHCK3123,LOANS AND LEASE FINANCING RECEIVABLES: LESS ALLOWANCE FOR CREDIT LOSSES ON LOAN AND LEASES,4508000
BHCK3128,ALLOCATED TRANSFER RISK RESERVE (BALANCE AT END OF PERIOD) (BHC CONSOLIDATED),24000
BHCK2145,PREMISES AND FIXED ASSETS (INCLUDING RIGHT OF USE ASSETS),8774000
BHCK2150,TOTAL OTHER REAL ESTATE OWNED (BHC CONSOLIDATED),50000
BHCK2130,INVESTMENTS IN UNCONSOLIDATED SUBSIDIARIES AND ASSOCIATED COMPANIES (BHC CONSOLIDATED),630000
BHCK3164,MORTGAGE SERVICING ASSETS (BHC CONSOLIDATED),0
BHCK3163,GOODWILL (BHC CONSOLIDATED),5950000
BHCK2160,OTHER ASSETS (BHC CONSOLIDATED),129128000
BHCK2170,TOTAL ASSETS (BHC CONSOLIDATED),1807982000
BHDM6631,NONINTEREST-BEARING DEPOSITS (BHC CONSOL. U.S. OFC),112000
BHDM6636,INTEREST-BEARING DEPOSITS (BHC CONSOL. U.S. OFC),370950000
BHFN6631,NONINTEREST-BEARING DEPOSITS (BHC CONSOL. FOREIGN OFC.),634000
BHFN6636,INTEREST-BEARING DEPOSITS (BHC CONSOL. FOREIGN OFC.),117389000
BHCK2309,COMMERCIAL PAPER (BHC CONSOLIDATED),0
BHCK2332,OTHER BORROWED MONEY WITH A REMAINING MATURITY OF 1 YR OR LESS (BHC CONSOLIDATED),83832000
BHCK2333,OTHER BORROWED MONEY WITH A REMAINING MATURITY OF > 1 YEAR (BHC CONSOLIDATED),275287000
BHCK4062,SUBORDINATED NOTES AND DEBENTURES (BHC CONSOLIDATED),11643000
BHCK3000,NONCONTROLLING (MINORITY) INTERESTS IN CONSOLIDATED SUBSIDIARIES (BHC CONSOLIDATED),361000
BHCK2948,TOTAL LIABILITIES (BHC CONSOLIDATED),1683219000
BHCK3283,PERPETUAL PREFERRED STOCK (BHC CONSOLIDATED),15153000
BHCK3230,COMMON STOCK (BHC CONSOLIDATED),9000
BHCK3240,SURPLUS (BHC CONSOLIDATED),67462000
BHCK3247,UNDIVIDED PROFITS & CAPITAL RESERVES (BHC CONSOLIDATED),162143000
BHCK3210,TOTAL BANK HOLDING COMPANY EQUITY CAPITAL (BHC CONSOLIDATED),124402000
BHCK3300,"TOT LIAB, RESERVE & CAPITAL ACCOUNTS (BHC CONSOLIDATED)",1807982000
BHCK2750,OTHER LIABILITIES (BHC CONSOLIDATED),287709000
BHCK0383,DEBT SECURITIES WITH REMAINING MATURITY OF 1 YEAR OR LESS (BHC CONSOLIDATED),22455000
BHCK0384,DEBT SECURITIES WITH REMAINING MATURITY OF 1-5 YEARS (BHC CONSOLIDATED),121682000
BHCK0387,DEBT SECURITIES WITH REMAINING MATURITY OF 5+ YEARS (BHC CONSOLIDATED),32494000
BHCK0416,PLEDGED SECURITIES (BHC CONSOLIDATED),16961000
BHCK1410,LOANS SECURED BY REAL ESTATE (BHC CONSOLIDATED),36132000
BHCK1763,COMMERCIAL AND INDUSTRIAL LOANS TO U.S. ADDRESSEES (DOMICILE) (BHC CONSOLIDATED),22363000
BHCK1764,COMMERCIAL AND INDUSTRIAL LOANS TO NON-U.S. ADDRESSEES (DOMICILE) (BHC CONSOLIDATED),15338000
BHCK1590,LOANS TO FINANCE AGRICULTURAL PRODUCTION AND OTHER LOANS TO FARMERS (BHC CONSOLIDATED),111000
BHCK2081,LOANS TO FOREIGN GOVERNMENTS AND OFFICIAL INSTITUTIONS (BHC CONSOLIDATED),22000
BHCK2123,UNEARNED INCOME ON LOANS (BHC CONSOLIDATED),0
BHDM1766,"C&I LOANS, ALL OTHER (BHC CONSOL. U.S. OFC)",29356000
BHDM1590,LOANS TO FINANCE AGRICULTURAL PROD (BHC CONSOL. U.S. OFC),39000
BHDM1975,"LOANS TO INDIVIDUALS, PERSONAL (BHC CONSOL. U.S. OFC)",31199000
BHDM2081,LNS TO FGN GOVTS & OFFICIAL INST (BHC CONSOL. U.S. OFC),22000
BHDM2165,LEASE FINANCING RECEIVABLES (BHC CONSOL. U.S. OFC),0
BHDM2123,UNEARNED INCOME ON LOANS (BHC CONSOL. U.S. OFC),0
BHDM2122,TOAL LOANS AND LEASES HELD FOR INVESTMENT AND HELD FOR SALE (BHC CONSOL. U.S. OFC),268888000
BHDM1420,R.E. LOANS-FARMLAND (BHC CONSOL. U.S. OFC),25000
BHDM1797,"REVOLVING, OPEN-END LNS SECD BY 1-4F (BHC CONSOL. U.S. OFC)",616000
BHDM1460,R.E. LOANS MULTI-FAMILY (BHC CONSOL. U.S. OFC),1827000
BHCK2746,"LNS TO FINC COMMCL RE,CONSTRC&LD DEV (BHC CONSOLIDATED)",3373000
BHCB2210,NONINTEREST-BEARING BALANCES (BHC CONSOL. COMML. BANKS),112000
BHCB3187,"INTEREST-BEARING DEMAND DEPOSITS, NOW, ATS, AND OTHER TRANSACTION ACCOUNTS (BHC CONSOL. COMML. BANKS)",171324000
BHCB2389,MONEY MARKET DEPOSIT ACCOUNTS AND OTHER SAVINGS ACCOUNTS (BHC CONSOL. COMML. BANKS),78196000
BHCK3197,EARNING ASSETS THAT ARE REPRICEABLE WITHIN 1 YEAR OR MATURE WITHIN 1 YEAR (BHC CONSOLIDATED),895736000
BHCK3296,VAR RT INT-BRG DEPS RPRIC OR MAT 1YR (BHC CONSOLIDATED),152529000
BHCK3408,VARIABLE RATE PREFERRED STOCK (BHC CONSOLIDATED),4678000
BHCK3409,"LONG-TERM DEBT REPORTED IN SCHDULE HC, ITEM 19A ON THE BALANCE SHEET THAT IS SCHEDULED TO MATURE WITHIN ONE YEAR (BHC CONSOLIDATED)",2306000
BHCK3368,QTLY AVG OF TOTAL ASSETS (BHC CONSOLIDATED),1806172000
BHCK3517,AVERAGE BALS OF INT-BEARING DEPOSITS (BHC CONSOLIDATED),366102000
BHCK3404,QTLY AVG OF INT-BRG DEPS IN FGN OFFC (BHC CONSOLIDATED),112183000
BHCK3519,AVERAGE BALS OF EQUITY CAPITAL (BHC CONSOLIDATED),123507000
BHCK2635,ALL OTHER BORROWED MONEY (QTRLY AVG) (BHC CONSOLIDATED),356614000
BHCK3365,FEDERAL FUNDS SOLD AND SECURITIES PURCHASED UNDER AGREEMENT TO RESELL (QTRLY AVG) (BHC CONSOLIDATED),366823000
BHCK3353,FEDERAL FUNDS PURCHASED AND SECURITIES SOLD UNDER AGREEMENTS TO REPURCHASE (QTRLY AVG) (BHC CONSOLIDATED),287048000
BHCK3298,"LONG-TERM DEBT THAT REPRICES WITHIN ONE YEAR INCLUDED IN ITEMS 16 AND 19A ON SCHEDULE HC, BALANCE SHEET (BHC CONSOLIDATED)",117051000
BHCK5369,LOANS AND LEASES HELD FOR SALE (BHC CONSOLIDATED),14884000
BHDM5367,ALL OTH LNS SECD BY 1-4FMLY-1ST LIEN (BHC CONSOL. U.S. OFC),18214000
BHDM5368,ALL OTH LNS SECD BY 1-4FMLY-JR LIENS (BHC CONSOL. U.S. OFC),613000
Report Date,,"September 30, 2025"
BHCK1754,AMORTIZED COST:  TOTAL (SUM OF 1 THROUGH 7),73281000
BHCK1773,"SECURITIES: AVAILABLE FOR SALE, FAIR VALUE (BHC CONSOLIDATED)",103350000
BHCK3548,TRADING LIABILITIES (BHC CONSOLIDATED),260422000
BHCK0211,"U.S. TREASURY SECURITIES, HELD TO MATURITY, AMORTIZED COST (BHC CONSOLIDATED)",46521000
BHCK0213,"U.S. TREASURY SECURITIES, HELD TO MATURITY, FAIR VALUE (BHC CONSOLIDATED)",46708000
BHCK1286,"U.S. TREASURY SECURITIES, AVAILABLE FOR SALE, AMORTIZED COST (BHC CONSOLIDATED)",96564000
BHCK1287,"U.S. TREASURY SECURITIES, AVAILABLE FOR SALE, FAIR VALUE (BHC CONSOLIDATED)",96720000
BHCK1752,"OTHER ASSETS, EQUITY INVESTMENTS WITHOUT DETERMINABLE FAIR VALUES (BHC CONSOLIDATED)",1676000
BHCK8782,STRUCTURED NOTES (INCLUDED IN THE HELD-TO-MATURITY AND AVAILABLE-FOR-SALE ACCOUNTS): AMORTIZED COST (BHC CONSOLIDATED),0
BHCK8783,STRUCTURED NOTES (INCLUDED IN THE HELD-TO-MATURITY AND AVAILABLE-FOR-SALE ACCOUNTS): FAIR VALUE (BHC CONSOLIDATED),0
BHCK3545,TRADING ASSETS (BHC CONSOLIDATED),659028000
BHCK3547,DERIVATIVES WITH A NEGATIVE FAIR VALUE (CONSOLIDATED) (BHC CONSOLIDATED),79531000
BHDM1288,LOANS TO DEPOSITORY INSTITUTIONS (BHC CONSOL. U.S. OFC),1243000
BHCK1292,LOANS TO U.S. BANKS AND OTHER U.S. DEPOSITORY INSTITUTIONS (BHC CONSOLIDATED),0
BHCK1296,LOANS TO FOREIGN BANKS (BHC CONSOLIDATED),1427000
BHFNA245,FOREIGN OFFICE TIME DEPOSITS WITH A REMAINING MATURITY OF ONE YEAR OR LESS (BHC CONSOL. FOREIGN OFC.),48043000
BHCKB528,"LOANS AND LEASES, HELD FOR INVESTMENT (BHC CONSOLIDATED)",297784000
BHCKB529,"LOANS AND LEASES, HELD FOR INVESTMENT, NET OF ALLOWANCE FOR LOAN AND LEASE LOSSES (BHC CONSOLIDATED)",293276000
BHCK3190,OTHER BORROWED MONEY (BHC CONSOLIDATED),359119000
BHCKB530,"EQUITY CAPITAL, ACCUMULATED OTHER COMPREHENSIVE INCOME (BHC CONSOLIDATED)",-2476000
BHCKA130,"EQUITY CAPITAL, OTHER EQUITY CAPITAL COMPONENTS (BHC CONSOLIDATED)",-117889000
BHCKB538,"LOANS TO INDIVIDUALS FOR HOUSEHOLD, FAMILY, AND OTHER PERSONAL EXPENDITURES, CREDIT CARDS (BHC CONSOLIDATED)",20037000
BHCKB539,"LOANS TO INDIVIDUALS FOR HOUSEHOLD, FAMILY, AND OTHER PERSONAL EXPENDITURES, OTHER REVOLVING CREDIT PLANS (BHC CONSOLIDATED)",0
BHCKB837,LOANS SECURED BY REAL ESTATE TO NON-US ADDRESSEES (DOMICILE) (BHC CONSOLIDATED),6111000
BHCK3401,AVERAGE BALANCE - TRADING ASSETS (BHC CONSOLIDATED),627415000
BHCKB985,AVERAGE BALANCE - OTHER EARNING ASSETS (BHC CONSOLIDATED),270672000
BHCBHK29,"TIME DEPOSITS $250,000 OR LESS (BHC CONSOL. COMML. BANKS) (BHC CONSOL. COMML. BANKS)",97036000
BHCBJ474,"TIME DEPOSITS $250,000+ (BHC CONSOL. COMML. BANKS) (BHC CONSOL. COMML. BANKS)",24394000
BHDMHK06,"BROKERED DEPOSITS $250,000 OR LESS WITH A REMAINING MATURITY OF ONE YEAR OR LESS (BHC CONSOL. U.S. OFC) (BHC CONSOL. U.S. OFC)",66011000
BHDMHK31,"BROKERED DEPOSITS $250,000 OR LESS WITH A REMAINING MATURITY OF MORE THAN ONE YEAR (BHC CONSOL. U.S. OFC) (BHC CONSOL. U.S. OFC)",11759000
BHDMHK32,"TIME DEPOSITS OF MORE THAN $250,000 WITH A REMAINING MATURITY OF ONE YEAR OR LESS (BHC CONSOL. U.S. OFC) (BHC CONSOL. U.S. OFC)",22917000
BHCK4059,"INT&FEE ON LNS IN FGN OFF,EDGE&AGREE AND IBFS (BHC CONSOLIDATED)",3504000
BHCK4065,INCOME FROM LEASE FINANCING RECEIVABLES (BHC CONSOLIDATED),0
BHCK4069,INTEREST INCOME FROM TRADING ASSETS (BHC CONSOLIDATED),12694000
BHCK4020,INTEREST INCOME ON FEDERAL FUNDS SOLD AND SECURITIES PURCHASED UNDER AGREEMENTS TO RESELL (BHC CONSOLIDATED),14025000
BHCK4107,TOTAL INTEREST INCOME (BHC CONSOLIDATED),59994000
BHCK4172,"INTEREST ON DEPOSITS IN FOREIGN OFFICES, EDGE AND AGREEMENT SUBS, AND IBFS (BHC CONSOLIDATED)",3038000
BHCK4180,EXPENSE OF FEDERAL FUNDS PURCHASED AND SECURITIES SOLD UNDER AGREEMENTS TO REPURCHASE (BHC CONSOLIDATED),12674000
BHCK4397,"INTEREST EXPENSE ON SUBORDINATED NOTES AND DEBENTURES, AND ON MANDATORY CONVERTIBLE SECURITIES (BHC CONSOLIDATED)",632000
BHCK4398,OTHER INTEREST EXPENSE (BHC CONSOLIDATED),12107000
BHCK4073,TOTAL INTEREST EXPENSE (BHC CONSOLIDATED),50143000
BHCK4074,NET INTEREST INCOME (BHC CONSOLIDATED),9851000
BHCK4230,PROVISIONS FOR CREDIT LOSSES FOR LOANS AND LEASES HELD FOR INVESTMENT,904000
BHCK4070,INCOME FROM FIDUCIARY ACTIVITIES (BHC CONSOLIDATED),110000
BHCK4483,"SERVICE CHGS, COMMISSIONS & FEES (BHC CONSOLIDATED)",0
BHCK4079,TOTAL NONINTEREST INCOME (BHC CONSOLIDATED),35061000
BHCK4135,SALARIES AND EMPLOYEE BENEFITS (BHC CONSOLIDATED),14241000
BHCK4217,"EXPENSE OF BANK PREMISES, FURNITURE, ETC. (BHC CONSOLIDATED)",906000
BHCK4092,OTHER NONINTEREST EXPENSE (BHC CONSOLIDATED),12609000
BHCK4093,TOTAL NONINTEREST EXPENSE (BHC CONSOLIDATED),27822000
BHCK4301,Income (loss) before applicable income taxes and discontinued operations (sum of items 8.a and 8.b),16021000
BHCK4302,APPLICABLE INCOME TAXES (BHC CONSOLIDATED),3438000
BHCK4300,Income (loss) before discontinued operations (item 8.c minus item 9),12583000
BHCK4340,NET INCOME (LOSS) ATTRIBUTABLE TO BANK HOLDING COMPANY (BHC CONSOLIDATED),12559000
BHCK4507,TAX-EXEMPT SECS ISSUED BY ST&POL SUB (BHC CONSOLIDATED),0
BHCK4518,OTHER INTEREST INCOME (BHC CONSOLIDATED),2143000
BHCK4519,NET INTEREST INCOME ON FULLY TAXABLE BASIS (BHC CONSOLIDATED),9965000
BHCK4592,"Net income before applicable income taxes, and discontinued operations (item 8.c. above) on a fully taxable equivalent basis",16135000
BHCK6761,INTEREST ON OTHER DEPOSITS IN DOMESTIC OFFICES (BHC CONSOLIDATED),7288000
BHCK3217,TOTAL BANK HOLDING COMPANY EQUITY CAPITAL MOST RECENTLY REPORTED FOR THE END OF PREVIOUS CALENDAR YEAR (BHC CONSOLIDATED),121996000
BHCK4356,"CHANGES IN EQUITY CAPITAL INCIDENT TO BUSINESS COMBINATIONS, NET (BHC CONSOLIDATED)",0
BHCK4598,CASH DIVIDENDS DECLARED ON PREFERRED STOCK (BHC CONSOLIDATED),643000
BHCK4460,CASH DIVIDENDS DECLARED ON COMMON STOCK (BHC CONSOLIDATED),3185000
BHCK4782,SALES OF TREASURY STOCK (BHC CONSOLIDATED),39000
BHCK4783,PURCHASES OF TREASURY STOCK (BHC CONSOLIDATED),9360000
BHCK4591,CHANGES TO OFFSETTING DEBT TO LIABILITY FOR ESOP DEBT GUARANTEED BY BHC (BHC CONSOLIDATED),0
BHCK3577,"SALE OF PERPETUAL PREFERRED STOCK, GROSS (BHC CONSOLIDATED)",1895000
BHCK3578,CONVERSION OR RETIREMENT OF PERPETUAL PREFERRED STOCK (BHC CONSOLIDATED),0
BHCK3579,"SALE OF COMMON STOCK, GROSS (BHC CONSOLIDATED)",0
BHCK3580,CONVERSION OR RETIREMENT OF COMMON STOCK (BHC CONSOLIDATED),941000
BHCK4652,"LOANS SECURED BY REAL ESTATE, NON-U.S. ADDRESSES: CHARGE-OFFS (BHC CONSOLIDATED)",0
BHCK4662,"LOANS SECURED BY REAL ESTATE, NON-U.S. ADDRESSES: RECOVERIES (BHC CONSOLIDATED)",0
BHCK4645,CHG-OFFS ON C&I LNS-U.S. ADDRESSES (BHC CONSOLIDATED),178000
BHCK4617,RECOV ON C & I LNS-U.S. ADDRESSES (BHC CONSOLIDATED),6000
BHCK4646,CHG-OFFS ON C&I LNS-NON-U.S. ADDRES (BHC CONSOLIDATED),6000
BHCK4618,RECOV ON C & I LNS-NON-U.S. ADDRES (BHC CONSOLIDATED),21000
BHCK4655,CHARGE-OFFS ON LOANS TO FARMERS (BHC CONSOLIDATED),0
BHCK4665,RECOVERIES ON LOANS TO FARMERS (BHC CONSOLIDATED),0
BHCK4643,CHG-OFFS ON LNS TO FGN GOVTS & INST (BHC CONSOLIDATED),0
BHCK4627,RECOV ON LNS TO FGN GOVTS & INST (BHC CONSOLIDATED),0
BHCK4605,ALLOWANCE FOR LOAN AND LEASE LOSSES: RECOVERIES (BHC CONSOLIDATED),152000
BHCK4635,ALLOWANCE FOR LOAN AND LEASE LOSSES: CHARGE-OFFS (BHC CONSOLIDATED),1225000
BHCK3584,CHG-OFFS ON LNS SECURED BY FARMLAND (BHC CONSOLIDATED),0
BHCK3585,RECVRS ON LNS SECURED BY FARMLAND (BHC CONSOLIDATED),0
BHCK3588,CHG-OFFS ON LNS SECD BY MULTI-FAMILY (BHC CONSOLIDATED),12000
BHCK3589,RECVRS ON LNS SECD BY MULTI-FMLY RES (BHC CONSOLIDATED),0
BHCK3581,OTHER ADJUSTMENTS TO EQUITY CAPITAL (BHC CONSOLIDATED),-66000
BHCK5411,"CHG-OFFS OF RVLVG,OPEN-END LNS SECD (BHC CONSOLIDATED)",0
BHCK5412,"RECOVERS OF RVLVG,OPEN-END LNS SECD (BHC CONSOLIDATED)",0
BHCK5409,"CHG-OFFS OF LNS TO FINC COMMCL RE,CO (BHC CONSOLIDATED)",0
BHCK5410,"RECOVERS OF LNS TO FINC COMMCL RE,CO (BHC CONSOLIDATED)",0
BHCK4644,CHG-OFFS ON ALL OTHER LOANS (BHC CONSOLIDATED),22000
BHCK4628,RECOV ON ALL OTHER LOANS (BHC CONSOLIDATED),4000
BHCK3521,REALIZED GAINS (LOSSES) ON HELD-TO-MATURITY SECURITIES (BHC CONSOLIDATED),0
BHCK3196,REALIZED GAINS (LOSSES) ON AVAILABLE-FOR-SALE SECURITIES (BHC CONSOLIDATED),-59000
BHCK8560,OTHER NON-INTEREST INCOME: NET GAINS (LOSSES) ON SALES OF LOANS (BHC CONSOLIDATED),10000
BHCK8561,OTHER NON-INTEREST INCOME: NET GAINS (LOSSES) ON SALES OF OTHER REAL ESTATE OWNED (BHC CONSOLIDATED),-3000
BHCK8562,1ST AMOUNT - OTHER NONINTEREST INCOME > 10% OF TOTAL (BHC CONSOLIDATED),830000
BHCK8563,2ND AMOUNT - OTHER NONINTEREST INCOME > 10% OF TOTAL (BHC CONSOLIDATED),-88000
BHCK8564,3RD AMOUNT - OTHER NONINTEREST INCOME > 10% OF TOTAL (BHC CONSOLIDATED),55000
BHCK8565,1ST AMOUNT - OTHER NONINTEREST EXPENSE > 10% OF TOTAL (BHC CONSOLIDATED),5773000
BHCK8566,2ND AMOUNT - OTHER NONINTEREST EXPENSE > 10% OF TOTAL (BHC CONSOLIDATED),1248000
BHCK8567,3RD AMOUNT - OTHER NONINTEREST EXPENSE > 10% OF TOTAL (BHC CONSOLIDATED),0
BHCK8757,TRADING REVENUE: INTEREST RATE EXPOSURES (BHC CONSOLIDATED),8498000
BHCK8758,TRADING REVENUE: FOREIGN EXCHANGE EXPOSURES (BHC CONSOLIDATED),-4013000
BHCK8759,TRADING REVENUE: EQUITY SECURITY AND INDEX EXPOSURES (BHC CONSOLIDATED),8311000
BHCK8760,TRADING REVENUE: COMMODITY AND OTHER EXPOSURES (BHC CONSOLIDATED),1660000
BHCK8431,INCOME FROM THE SALE AND SERVICING OF MUTUAL FUNDS AND ANNUITIES (IN DOMESTIC OFFICES) (BHC CONSOLIDATED),1601000
BHCKA220,TRADING REVENUE (BHC CONSOLIDATED),15350000
BHCKA251,CREDIT LOSSES ON OFF-BALANCE SHEET DERIVATIVE CONTRACTS (BHC CONSOLIDATED),0
BHCKA530,"SUBCHAPTER S ELECTION IN EFFECT FOR FEDERAL INCOME TAX PURPOSES FOR CURRENT YEAR (1=YES, 0=NO) (BHC CONSOLIDATED)",0
BHCK4115,INTEREST INCOME ON BALANCES DUE FROM DEPOSITORY INSTITUTIONS (BHC CONSOLIDATED),4576000
BHCKB488,INTEREST & DIVIDEND INCOME ON US TREASURY SECURITIES AND US GOVERNMENT AGENCY OBLIGATIONS (EXCLUDE MORTGAGE-BACKED SECURITIES (BHC CONSOLIDATED),4019000
BHCKB489,INTEREST & DIVIDEND INCOME ON MORTGAGE-BACKED SECURITIES (BHC CONSOLIDATED),959000
BHCK4060,INTEREST & DIVIDEND INCOME ON ALL OTHER SECURITIES (BHC CONSOLIDATED),117000
BHCK4185,INTEREST ON TRADING LIABILITIES AND OTHER BORROWED MONEY (EXCLUDE SUBORDINATED NOTES AND DEBENTURES) (BHC CONSOLIDATED),10986000
BHCKB491,NONINTEREST INCOME: VENTURE CAPITAL REVENUE (BHC CONSOLIDATED),0
BHCKB492,NONINTEREST INCOME: NET SERVICING FEES (BHC CONSOLIDATED),3000
BHCKB493,NONINTEREST INCOME: NET SECURITIZATION INCOME (BHC CONSOLIDATED),207000
BHCKB496,NONINTEREST INCOME: NET GAINS(LOSSES) ON SALES OF OTHER ASSETS (BHC CONSOLIDATED),19000
BHCKB497,NONINTEREST INCOME: OTHER (BHC CONSOLIDATED),449000
BHCKB983,"BENEFITS, LOSSES, AND EXPENSES FROM INSURANCE RELATED ACTIVITIES (BHC CONSOLIDATED)",1000
BHCK4313,INCOME ON TAX-EXEMPT LOANS AND LEASES TO STATES AND POLITICAL SUBDIVISIONS IN THE US (BHC CONSOLIDATED),0
BHCKB507,"CHANGES EQUITY CAPITAL, RESTATEMENTS DUE TO CORRECTIONS OF MATERIAL ACCOUNTING ERRORS AND CHANGES IN ACCOUNTING PRINCIPLES (BHC CONSOLIDATED)",0
BHCKB508,"CHANGES IN EQUITY CAPITAL, BALANCE END OF PREVIOUS CALENDAR YEAR AS RESTATED (BHC CONSOLIDATED)",121996000
BHCKB511,"CHANGES IN EQUITY CAPITAL, OTHER COMPREHENSIVE INCOME (BHC CONSOLIDATED)",226000
BHCKB512,LOANS SECURED BY REAL ESTATE: IN FOREIGN OFFICES CHARGE-OFFS (BHC CONSOLIDATED),0
BHCKB513,LOANS SECURED BY REAL ESTATE: IN FOREIGN OFFICES RECOVERIES (BHC CONSOLIDATED),0
BHCKB514,"LOANS TO INDIVIDUALS FOR HOUSEHOLD, FAMILY, AND OTHER PERSONAL EXPENDITURES: CREDIT CARDS CHARGE-OFFS (BHC CONSOLIDATED)",1006000
BHCKB515,"LOANS TO INDIVIDUALS FOR HOUSEHOLD, FAMILY, AND OTHER PERSONAL EXPENDITURES: CREDIT CARDS RECOVERIES (BHC CONSOLIDATED)",121000
BHCKB522,CHANGES IN ALLOWANCE FOR LOAN AND LEASE LOSSES: BALANCE MOST RECENTLY REPORTED AT END OF PREVIOUS YEAR (BHC CONSOLIDATED),4666000
BHCK8496,"SECURITIES ISSUED BY US STATE & POLITICAL SUBDIVISIONS, H-T-M, AMORTIZED COST (BHC CONSOLIDATED)",0
BHCK8497,"SECURITIES ISSUED BY US STATE & POLITICAL SUBDIVISIONS, H-T-M, FAIR VALUE (BHC CONSOLIDATED)",0
BHCK8498,"SECURITIES ISSUED BY US STATE & POLITICAL SUBDIVISIONS, A-F-S, AMORTIZED COST (BHC CONSOLIDATED)",0
BHCK8499,"SECURITIES ISSUED BY US STATE & POLITICAL SUBDIVISIONS, A-F-S, FAIR VALUE (BHC CONSOLIDATED)",0
BHCKB838,"ASSET-BACKED SECURITIES: CREDIT CARD RECEIVABLES, H-T-M AMORTIZED COST (BHC CONSOLIDATED)",0
BHCKB839,"ASSET-BACKED SECURITIES: CREDIT CARD RECEIVABLES, H-T-M FAIR VALUE (BHC CONSOLIDATED)",0
BHCKB840,"ASSET-BACKED SECURITIES: CREDIT CARD RECEIVABLES, A-F-S AMORTIZED COST (BHC CONSOLIDATED)",0
BHCKB841,ASSET-BACKED SECURITIES: CREDIT CARD RECEIVABLES A-F-S FAIR VALUE (BHC CONSOLIDATED),0
BHCKB842,"ASSET-BACKED SECURITIES: HOME EQUITY LINES, H-T-M AMORTIZED COST (BHC CONSOLIDATED)",0
BHCKB843,"ASSET-BACKED SECURITIES: HOME EQUITY LINES, H-T-M FAIR VALUE (BHC CONSOLIDATED)",0
BHCKB844,"ASSET-BACKED SECURITIES: HOME EQUITY LINES, A-F-S AMORTIZED COST (BHC CONSOLIDATED)",0
BHCKB845,"ASSET-BACKED SECURITIES: HOME EQUITY LINES, A-F-S FAIR VALUE (BHC CONSOLIDATED)",0
BHCKB846,"ASSET-BACKED SECURITIES: AUTOMOBILE LOANS, H-T-M AMORTIZED COST (BHC CONSOLIDATED)",0
BHCKB847,"ASSET-BACKED SECURITIES: AUTOMOBILE LOANS, H-T-M FAIR VALUE (BHC CONSOLIDATED)",0
BHCKB848,"ASSET-BACKED SECURITIES: AUTOMOBILE LOANS, A-F-S AMORTIZED COST (BHC CONSOLIDATED)",0
BHCKB849,"ASSET-BACKED SECURITIES: AUTOMOBILE LOANS, A-F-S FAIR VALUE (BHC CONSOLIDATED)",0
BHCKB850,"ASSET-BACKED SECURITIES: OTHER CONSUMER LOANS, H-T-M AMORTIZED COST (BHC CONSOLIDATED)",0
BHCKB851,"ASSET-BACKED SECURITIES: OTHER CONSUMER LOANS, H-T-M FAIR VALUE (BHC CONSOLIDATED)",0
BHCKB852,"ASSET-BACKED SECURITIES: OTHER CONSUMER LOANS, A-F-S AMORTIZED COST (BHC CONSOLIDATED)",0
BHCKB853,"ASSET-BACKED SECURITIES: OTHER CONSUMER LOANS, A-F-S FAIR VALUE (BHC CONSOLIDATED)",0
BHCKB854,"ASSET-BACKED SECURITIES: COMMERCIAL & INDUSTRIAL LOANS, H-T-M AMORTIZED COST (BHC CONSOLIDATED)",0
BHCKB855,"ASSET-BACKED SECURITIES: COMMERCIAL & INDUSTRIAL LOANS, H-T-M FAIR VALUE (BHC CONSOLIDATED)",0
BHCKB856,"ASSET-BACKED SECURITIES: COMMERCIAL & INDUSTRIAL LOANS, A-F-S AMORTIZED COST (BHC CONSOLIDATED)",0
BHCKB857,"ASSET-BACKED SECURITIES: COMMERCIAL & INDUSTRIAL LOANS, A-F-S FAIR VALUE (BHC CONSOLIDATED)",0
BHCKB858,"ASSET-BACKED SECURITIES: OTHER, H-T-M AMORTIZED COST (BHC CONSOLIDATED)",0
BHCKB859,"ASSET-BACKED SECURITIES: OTHER, H-T-M FAIR VALUE (BHC CONSOLIDATED)",0
BHCKB860,"ASSET-BACKED SECURITIES: OTHER, A-F-S AMORTIZED COST (BHC CONSOLIDATED)",0
BHCKB861,"ASSET-BACKED SECURITIES: OTHER, A-F-S FAIR VALUE (BHC CONSOLIDATED)",0
BHCK1737,"OTHER DOMESTIC DEBT SECURITIES, H-T-M, AMORTIZED COST (BHC CONSOLIDATED)",0
BHCK1738,"OTHER DOMESTIC DEBT SECURITIES, H-T-M, FAIR VALUE (BHC CONSOLIDATED)",0
BHCK1739,"OTHER DOMESTIC DEBT SECURITIES, A-F-S, AMORTIZED COST (BHC CONSOLIDATED)",0
BHCK1741,"OTHER DOMESTIC DEBT SECURITIES, A-F-S, FAIR VALUE (BHC CONSOLIDATED)",0
BHCK1742,"FOREIGN DEBT SECURITIES, H-T-M, AMORTIZED COST (BHC CONSOLIDATED)",925000
BHCK1743,"FOREIGN DEBT SECURITIES, H-T-M, FAIR VALUE (BHC CONSOLIDATED)",928000
BHCK1744,"FOREIGN DEBT SECURITIES, A-F-S, AMORTIZED COST (BHC CONSOLIDATED)",6929000
BHCK1746,"FOREIGN DEBT SECURITIES, A-F-S, FAIR VALUE (BHC CONSOLIDATED)",6630000
BHCK1771,"TOTAL HELD-TO-MATURITY SECURITIES, FAIR VALUE (BHC CONSOLIDATED)",73697000
BHCK1772,"TOTAL AVAILABLE-FOR-SALE SECURITIES, AMORTIZED COST (BHC CONSOLIDATED)",103493000
BHCKB990,"PROP & CASUALTY LIABILITIES - POLICY BENEFITS, RESERVES, AND LOSS ADJUSTED EXPENSES (BHC CONSOLIDATED)",5000
BHCKB991,PROP & CASUALTY LIABILITIES - UNEARNED PREMIUMS (BHC CONSOLIDATED),0
BHCKB992,LIFE & HEALTH ASSETS - SEPARATE ACCOUNT ASSETS (BHC CONSOLIDATED),0
BHCKB994,"LIFE & HEALTH LIABILITIES - POLICY BENEFITS, RESERVES, AND LOSS ADJUSTED EXPENSES (BHC CONSOLIDATED)",82000
BHCKB996,LIFE & HEALTH LIABILITIES - SEPARATE ACCOUNT LIABILITIES (BHC CONSOLIDATED),0
BHCKB569,"DOES THE HOLDING COMPANY SELL PRIVATE LABEL OR THIRD PARTY MUTUAL FUNDS AND ANNUITIES ? (1=YES,0=NO) (BHC CONSOLIDATED)",1
BHCKB570,ASSETS UNDER MANAGEMENT IN PROPRIETARY MUTUAL FUNDS AND ANNUITIES (BHC CONSOLIDATED),1033213000
BHCKC079,TOTAL CHARGE-OFFS AND WRITE-DOWNS ARISING FROM TRANSFERS OF LOANS TO HELD-FOR-SALE ACCOUNT (BHC CONSOLIDATED),1110000
BHCK5523,WRITE-DOWNS ARISING FROM TRANSFERS OF LOANS TO THE HELD-FOR-SALE ACCOUNT (BHC CONSOLIDATED),115000
BHCKC159,DO YOUR AGGREGATE NONFINANCIAL EQUITY INVESTMENTS EQUAL OR EXCEED THE LESSER OF $100 MILLION (ON AN ACQUISITION COST BASIS) OR 10% OF THE BHC'S CONSOLIDATED TIER 1 CAPITAL AS OF THE REPORT DATE? (1=YE,1
BHCKC161,"DOES THE BHC HOLD, DIRECT OR INDIRECT, ANY NONFINANCIAL EQUITY INVESTMENTS WITHIN A SMALL BUS INVEST CO (SIBC) OR UNDER SECTION 4(C)(6) OR 4(C)(7) OF BHC ACT, OR PURSUANT TO THE MERCHANT BANKING AUTHO",1
BHCKC216,NONINTEREST EXPENSE: GOODWILL IMPAIRMENT LOSSES (BHC CONSOLIDATED),3000
BHCKC232,NONINTEREST EXPENSE: AMORTIZATION EXPENSE AND IMPAIRMENT LOSSES FOR OTHER INTANGIBLE ASSETS (BHC CONSOLIDATED),63000
BHCKC234,CLOSED-END LOANS SECURED BY 1-4 FAMILY RESIDENTIAL PROPERTIES: SECURED BY FIRST LIENS: CHARGE-OFFS (BHC CONSOLIDATED),0
BHCKC217,CLOSED-END LOANS SECURED BY 1-4 FAMILY RESIDENTIAL PROPERTIES: SECURED BY FIRST LIENS: RECOVERIES (BHC CONSOLIDATED),0
BHCKC235,CLOSED-END LOANS SECURED BY 1-4 FAMILY RESIDENTIAL PROPERTIES: SECURED BY JUNIOR LIENS: CHARGE-OFFS (BHC CONSOLIDATED),0
BHCKC218,CLOSED-END LOANS SECURED BY 1-4 FAMILY RESIDENTIAL PROPERTIES: SECURED BY JUNIOR LIENS: RECOVERIES (BHC CONSOLIDATED),0
BHCKC233,CHANGES IN ALLOWANCE FOR LOAN AND LEASE LOSSES: ADJUSTMENTS (BHC CONSOLIDATED),11000
BHDMB987,FEDERAL FUNDS SOLD IN DOMESTIC OFFICES (BHC CONSOL. U.S. OFC),0
BHCKB989,SECURITIES PURCHASED UNDER AGREEMENT TO RESELL (BHC CONSOLIDATED),346306000
BHDMB993,FEDERAL FUNDS PURCHASED IN DOMESTIC OFFICES (BHC CONSOL. U.S. OFC),0
BHCKB995,SECURITES SOLD UNDER AGREEMENTS TO REPURCHASE (BHC CONSOLIDATED),274209000
BHCKHK03,"INTEREST ON TIME DEPOSITS OF $250,000 OR LESS (BHC CONSOLIDATED) (BHC CONSOLIDATED)",2767000
BHCKHK04,"INTEREST ON TIME DEPOSITS MORE THAN $250,000 (BHC CONSOLIDATED) (BHC CONSOLIDATED)",651000
BHCKG300,MORTGAGE-BACKED SECURITIES (MBS): RESIDENTIAL PASS-THROUGH SECURITIES: GUARANTEED BY GNMA (HELD-TO-MATURITY: AMORTIZED COST) (BHC CONSOLIDATED),25657000
BHCKG301,MORTGAGE-BACKED SECURITIES (MBS): RESIDENTIAL PASS-THROUGH SECURITIES: GUARANTEED BY GNMA (HELD-TO-MATURITY: FAIR VALUE) (BHC CONSOLIDATED),25882000
BHCKG302,MORTGAGE-BACKED SECURITIES (MBS): RESIDENTIAL PASS-THROUGH SECURITIES: GUARANTEED BY GNMA (AVAILABLE-FOR-SALE: AMORTIZED COST) (BHC CONSOLIDATED),0
BHCKG303,MORTGAGE-BACKED SECURITIES (MBS): RESIDENTIAL PASS-THROUGH SECURITIES: GUARANTEED BY GNMA (AVAILABLE-FOR-SALE: FAIR VAULE) (BHC CONSOLIDATED),0
BHCKG304,MORTGAGE-BACKED SECURITIES (MBS): RESIDENTIAL PASS-THROUGH SECURITIES: ISSUED BY FNMA AND FHLMC (HELD-TO-MATURITY: AMORTIZED COST) (BHC CONSOLIDATED),0
BHCKG305,MORTGAGE-BACKED SECURITIES (MBS): RESIDENTIAL PASS-THROUGH SECURITIES: ISSUED BY FNMA AND FHLMC (HELD-TO-MATURITY: FAIR VALUE) (BHC CONSOLIDATED),0
BHCKG306,MORTGAGE-BACKED SECURITIES (MBS): RESIDENTIAL PASS-THROUGH SECURITIES: ISSUED BY FNMA AND FHLMC (AVAILABLE-FOR-SALE: AMORTIZED COST) (BHC CONSOLIDATED),0
BHCKG307,MORTGAGE-BACKED SECURITIES (MBS): RESIDENTIAL PASS-THROUGH SECURITIES: ISSUED BY FNMA AND FHLMC (AVAILABLE-FOR-SALE: FAIR VAULE) (BHC CONSOLIDATED),0
BHCKG308,MORTGAGE-BACKED SECURITIES (MBS): RESIDENTIAL PASS-THROUGH SECURITIES: OTHER PASS-THROUGH SECURITIES (HELD-TO-MATURITY: AMORTIZED COST) (BHC CONSOLIDATED),0
BHCKG309,MORTGAGE-BACKED SECURITIES (MBS): RESIDENTIAL PASS-THROUGH SECURITIES: OTHER PASS-THROUGH SECURITIES (HELD-TO-MATURITY: FAIR VALUE) (BHC CONSOLIDATED),0
BHCKG310,MORTGAGE-BACKED SECURITIES (MBS): RESIDENTIAL PASS-THROUGH SECURITIES: OTHER PASS-THROUGH SECURITIES (AVAILABLE-FOR-SALE: AMORTIZED COST) (BHC CONSOLIDATED),0
BHCKG311,MORTGAGE-BACKED SECURITIES (MBS): RESIDENTIAL PASS-THROUGH SECURITIES: OTHER PASS-THROUGH SECURITIES (AVAILABLE-FOR-SALE: FAIR VAULE) (BHC CONSOLIDATED),0
BHCKG312,"MORTGAGE-BACKED SECURITIES (MBS): OTHER RESIDENTIAL MORTGAGE-BACKED SECURITIES (INCLUDE CMOS, REMICS, AND STRIPPED MBS): ISSUED OR GUARANTEED BY U.S. GOVERNMENT AGENCIES OR SPONSORED AGENCIES (HELD-TO",0
